b'RCS\xc2\xa0#',b'Sort1',b'Sort2',b'Doc.',b'Subject/Motion',b'Date',b'Vote',b'Aye',b'No',b'Not\xc2\xa0Voting',b'Exc.\xc2\xa0Abs.',b'Exc.\xc2\xa0Vote',b'Total\xc2\xa0Votes',b'Result'b'33',b'S',b'181',b'SB 181',b'Wake County Commissioner Districts.      Second Reading',b'3/11/2015 4:53 PM',b'Aye',b'PASS',b'31',b'16',b'0',b'3',b'0',b'47'
b'34',b'S',b'53',b'SB 53',b'Cities/Overgrown Vegetation Notice.      Second Reading',b'3/11/2015 4:54 PM',b'Aye',b'PASS',b'46',b'0',b'1',b'3',b'0',b'46'
b'35',b'S',b'78',b'SB 78',b'Off-Duty Correctional Officers/Conceal Carry.      Amendment 1',b'3/11/2015 4:57 PM',b'Aye',b'PASS',b'46',b'1',b'0',b'3',b'0',b'47'
b'36',b'S',b'78',b'SB 78',b'Off-Duty Correctional Officers/Conceal Carry.      Second Reading',b'3/11/2015 4:58 PM',b'Aye',b'PASS',b'45',b'2',b'0',b'3',b'0',b'47'
b'37',b'S',b'89',b'SB 89',b'Disqualification Notice/Pistol Sale Permit.      Second Reading',b'3/11/2015 5:01 PM',b'Aye',b'PASS',b'46',b'0',b'1',b'3',b'0',b'46'
b'39',b'S',b'36',b'SB 36',b'Greensboro City Council Changes.      Third Reading',b'3/12/2015 9:23 AM',b'Aye',b'PASS',b'33',b'15',b'1',b'1',b'0',b'48'
b'40',b'S',b'181',b'SB 181',b'Wake County Commissioner Districts.      Amendment 2',b'3/12/2015 9:25 AM',b'Aye',b'PASS',b'33',b'15',b'1',b'1',b'0',b'48'
b'41',b'S',b'181',b'SB 181',b'Wake County Commissioner Districts.      Third Reading',b'3/12/2015 9:25 AM',b'Aye',b'PASS',b'32',b'16',b'1',b'1',b'0',b'48'
b'43',b'S',b'161',b'SB 161',b'Supreme Court Sessions in Morganton.      Second Reading',b'3/16/2015 7:13 PM',b'Aye',b'PASS',b'47',b'2',b'0',b'1',b'0',b'49'
b'44',b'S',b'185',b'SB 185',b'Clarify Credit for Time Served.      Second Reading',b'3/16/2015 7:17 PM',b'Aye',b'PASS',b'49',b'0',b'0',b'1',b'0',b'49'
b'45',b'S',b'316',b'SR 316',b'Reaffirming Support for Public Schools.      Motion 8 To Adopt',b'3/18/2015 2:20 PM',b'Aye',b'PASS',b'48',b'0',b'0',b'2',b'0',b'48'
b'47',b'S',b'114',b'SB 114',b'Custodial Parent/Party Cooperate w/Child Supp.      Second Reading',b'3/18/2015 3:06 PM',b'Aye',b'PASS',b'48',b'0',b'0',b'2',b'0',b'48'
b'51',b'S',b'29',b'SB 29',b'DOB Redaction Requests For Public Documents.      Second Reading',b'3/24/2015 2:17 PM',b'Aye',b'PASS',b'48',b'0',b'0',b'2',b'0',b'48'
b'52',b'S',b'123',b'SB 123',b'Uniform Fraudulent Transfer Act.      Second Reading',b'3/24/2015 2:19 PM',b'Aye',b'PASS',b'48',b'0',b'0',b'2',b'0',b'48'
b'53',b'S',b'326',b'SB 326',b'Increase JDIG Program Funding.      Second Reading',b'3/24/2015 2:21 PM',b'Aye',b'PASS',b'48',b'0',b'0',b'2',b'0',b'48'
b'54',b'S',b'140',b'SB 140',b'Lake Santeetlah Occupancy Tax Authorization.      Second Reading',b'3/25/2015 2:12 PM',b'Aye',b'PASS',b'45',b'4',b'0',b'1',b'0',b'49'
b'55',b'S',b'156',b'SB 156',b'Mt. Gilead Charter Revision & Consolidation.      Second Reading',b'3/25/2015 2:13 PM',b'Aye',b'PASS',b'49',b'0',b'0',b'1',b'0',b'49'
b'56',b'S',b'305',b'SB 305',b'NCEMPA Asset Sale.      Second Reading',b'3/25/2015 2:25 PM',b'Aye',b'PASS',b'47',b'1',b'1',b'1',b'0',b'48'
b'57',b'S',b'6',b'SB 6',b'State Health Plan/Rehired Retiree Eligibility.      Second Reading',b'3/25/2015 2:28 PM',b'Aye',b'PASS',b'49',b'0',b'0',b'1',b'0',b'49'
b'58',b'S',b'334',b'SJR 334',b'SBCC Election.      Second Reading',b'3/26/2015 11:13 AM',b'Excused Absence',b'PASS',b'48',b'0',b'1',b'1',b'0',b'48'
b'59',b'S',b'140',b'SB 140',b'Lake Santeetlah Occupancy Tax Authorization.      Third Reading',b'3/26/2015 11:16 AM',b'Excused Absence',b'PASS',b'44',b'4',b'1',b'1',b'0',b'48'
b'60',b'S',b'156',b'SB 156',b'Mt. Gilead Charter Revision & Consolidation.      Third Reading',b'3/26/2015 11:16 AM',b'Excused Absence',b'PASS',b'48',b'0',b'1',b'1',b'0',b'48'
b'61',b'S',b'305',b'SB 305',b'NCEMPA Asset Sale.      Third Reading',b'3/26/2015 11:19 AM',b'Excused Absence',b'PASS',b'46',b'1',b'1',b'1',b'1',b'47'
b'62',b'S',b'105',b'SB 105',b'Include No. Veterans Employed/Annual Report.      Second Reading',b'3/26/2015 11:21 AM',b'Excused Absence',b'PASS',b'49',b'0',b'0',b'1',b'0',b'49'
b'63',b'S',b'112',b'SB 112',b'Comm. Fishing Courses/Coastal Colleges.      Second Reading',b'3/26/2015 11:23 AM',b'Excused Absence',b'PASS',b'49',b'0',b'0',b'1',b'0',b'49'
b'64',b'S',b'176',b'SB 176',b'Charter School Grade Level Expansion.      Second Reading',b'3/26/2015 11:25 AM',b'Excused Absence',b'PASS',b'49',b'0',b'0',b'1',b'0',b'49'
b'65',b'S',b'20',b'SB 20',b'IRC Update/Motor Fuel Tax Changes.      Conference Rpt       \nMotion 8 To Adopt  Second Reading',b'3/30/2015 7:25 PM',b'Aye',b'PASS',b'40',b'9',b'0',b'1',b'0',b'49'
b'66',b'S',b'14',b'SB 14',b'Acad. Standards/Rules Review/Coal Ash/Funds.      Conference Rpt\nMotion 8 To Adopt',b'3/30/2015 7:29 PM',b'Aye',b'PASS',b'48',b'1',b'0',b'1',b'0',b'49'
b'67',b'S',b'20',b'SB 20',b'IRC Update/Motor Fuel Tax Changes.      Conference Rpt          \nMotion 8 To Adopt  Third Reading',b'3/31/2015 2:23 PM',b'Aye',b'PASS',b'41',b'8',b'0',b'1',b'0',b'49'
b'69',b'S',b'248',b'SB 248',b'Town of Cary/Release Unneeded Easements.      Second Reading',b'4/1/2015 2:55 PM',b'Aye',b'PASS',b'48',b'0',b'0',b'2',b'0',b'48'
b'70',b'S',b'252',b'SB 252',b'Wake Cty Local Board of Equalization/Review.      Second Reading',b'4/1/2015 2:55 PM',b'Aye',b'PASS',b'48',b'0',b'0',b'2',b'0',b'48'
b'71',b'S',b'258',b'SB 258',b'Party Exec. Comm./Fill Vacancy/Washington Cty.      Second Reading',b'4/1/2015 2:55 PM',b'Aye',b'PASS',b'48',b'0',b'0',b'2',b'0',b'48'
b'72',b'S',b'247',b'SB 247',b'Raleigh/Donate Service Animals to Officers.      Amendment 1',b'4/1/2015 2:57 PM',b'Aye',b'PASS',b'48',b'0',b'0',b'2',b'0',b'48'
b'73',b'S',b'247',b'SB 247',b'Raleigh/Donate Service Animals to Officers.      Second Reading',b'4/1/2015 2:59 PM',b'Aye',b'PASS',b'48',b'0',b'0',b'2',b'0',b'48'
b'74',b'S',b'52',b'SB 52',b'Cities/Means For Activating Parking Meters.      Second Reading',b'4/1/2015 3:01 PM',b'Aye',b'PASS',b'48',b'0',b'0',b'2',b'0',b'48'
b'75',b'S',b'71',b'SB 71',b'Stagger RRC Member Terms.      Second Reading',b'4/1/2015 3:05 PM',b'Aye',b'PASS',b'47',b'1',b'0',b'2',b'0',b'48'
b'76',b'S',b'199',b'SB 199',b'Funds Deposited with Clerk of Court.      Second Reading',b'4/1/2015 3:06 PM',b'Aye',b'PASS',b'48',b'0',b'0',b'2',b'0',b'48'
b'77',b'S',b'372',b'SB 372',b'Renewable Energy Safe Harbor.      Second Reading',b'4/1/2015 3:16 PM',b'Aye',b'PASS',b'37',b'7',b'1',b'2',b'3',b'44'
b'78',b'S',b'379',b'SB 379',b'Cemeteries Located on State Property.      Second Reading',b'4/1/2015 3:19 PM',b'Aye',b'PASS',b'46',b'0',b'1',b'3',b'0',b'46'
b'80',b'S',b'43',b'SB 43',b'CDLs for Veterans Revisions.      Second Reading',b'4/2/2015 11:15 AM',b'Aye',b'PASS',b'44',b'0',b'0',b'6',b'0',b'44'
b'81',b'S',b'90',b'SB 90',b'Required Number of Operating Brake Lights.      Second Reading',b'4/2/2015 11:16 AM',b'Aye',b'PASS',b'44',b'0',b'0',b'6',b'0',b'44'
b'82',b'S',b'116',b'SB 116',b'Handicapped Parking Windshield Placard.      Second Reading',b'4/2/2015 11:19 AM',b'Aye',b'PASS',b'44',b'0',b'0',b'6',b'0',b'44'
b'83',b'S',b'188',b'SB 188',b'Adjust Cap on Turnpike Projects.      Second Reading',b'4/2/2015 11:31 AM',b'No',b'PASS',b'37',b'7',b'0',b'6',b'0',b'44'
b'84',b'S',b'279',b'SB 279',b'Amend Qualifications/Practice of Counseling.      Amendment 1',b'4/2/2015 11:41 AM',b'Aye',b'PASS',b'34',b'10',b'0',b'6',b'0',b'44'
b'85',b'S',b'279',b'SB 279',b'Amend Qualifications/Practice of Counseling.      Second Reading',b'4/2/2015 11:51 AM',b'Aye',b'PASS',b'33',b'11',b'0',b'6',b'0',b'44'
b'86',b'S',b'315',b'SB 315',b'School Playgrounds Available to Public.      Second Reading',b'4/2/2015 11:53 AM',b'Aye',b'PASS',b'44',b'0',b'0',b'6',b'0',b'44'
b'87',b'S',b'359',b'SB 359',b'Promote NC-Thinks.      Second Reading',b'4/2/2015 11:58 AM',b'Aye',b'PASS',b'44',b'0',b'0',b'6',b'0',b'44'
b'88',b'S',b'188',b'SB 188',b'Adjust Cap on Turnpike Projects.      Third Reading',b'4/2/2015 12:05 PM',b'No',b'PASS',b'40',b'4',b'0',b'6',b'0',b'44'
b'89',b'S',b'154',b'SB 154',b'Clarifying the Good Samaritan Law.      Second Reading',b'4/14/2015 2:17 PM',b'Aye',b'PASS',b'49',b'0',b'0',b'1',b'0',b'49'
b'90',b'S',b'183',b'SB 183',b'Eliminate CRVs for Misdemeanants.      Second Reading',b'4/14/2015 2:19 PM',b'Aye',b'PASS',b'49',b'0',b'0',b'1',b'0',b'49'
b'91',b'S',b'233',b'SB 233',b'Automatic Expunction/Mistaken Identity.      Second Reading',b'4/14/2015 2:20 PM',b'Aye',b'PASS',b'48',b'1',b'0',b'1',b'0',b'49'
b'92',b'S',b'269',b'SB 269',b'Landlord/Tenant-Alias and Pluries Summary Eject.      Second Reading',b'4/14/2015 2:22 PM',b'Aye',b'PASS',b'49',b'0',b'0',b'1',b'0',b'49'
b'93',b'S',b'311',b'SB 311',b'Register of Deeds/Filing False Marriage Docs.      Second Reading',b'4/14/2015 2:24 PM',b'Aye',b'PASS',b'49',b'0',b'0',b'1',b'0',b'49'
b'94',b'S',b'488',b'SB 488',b'Amend Uniform Interstate Family Support Act.-AB      Second Reading',b'4/14/2015 2:26 PM',b'Aye',b'PASS',b'49',b'0',b'0',b'1',b'0',b'49'
b'95',b'S',b'675',b'SB 675',b'Limit Parole Review Frequency.      Second Reading',b'4/14/2015 2:28 PM',b'Aye',b'PASS',b'49',b'0',b'0',b'1',b'0',b'49'
b'96',b'S',b'123',b'SB 123',b'Uniform Fraudulent Transfer Act.      Third Reading',b'4/14/2015 2:29 PM',b'Aye',b'PASS',b'48',b'1',b'0',b'1',b'0',b'49'
b'97',b'S',b'366',b'SB 366',b'Amend Certain Reqs/Permanency Innovation Comm.      Second Reading',b'4/15/2015 2:24 PM',b'Aye',b'PASS',b'50',b'0',b'0',b'0',b'0',b'50'
b'98',b'S',b'462',b'SB 462',b'Public Authorities/Nonprofit Corporations.      Second Reading',b'4/15/2015 2:25 PM',b'Aye',b'PASS',b'50',b'0',b'0',b'0',b'0',b'50'
b'99',b'S',b'487',b'SB 487',b'Health Choice Technical Revisions.-AB      Amendment 1',b'4/15/2015 2:27 PM',b'Aye',b'PASS',b'50',b'0',b'0',b'0',b'0',b'50'
b'100',b'S',b'487',b'SB 487',b'Health Choice Technical Revisions.-AB      Second Reading',b'4/15/2015 2:28 PM',b'Aye',b'PASS',b'50',b'0',b'0',b'0',b'0',b'50'
b'100',b'S',b'334',b'SJR 334',b'SBCC Election.      Second Reading',b'3/26/2015 1:37 PM',b'Aye',b'PASS',b'114',b'0',b'0',b'6',b'0',b'114'
b'101',b'S',b'682',b'SB 682',b'Modify Sunset Re: Contingent Audits.      Second Reading',b'4/15/2015 2:30 PM',b'Aye',b'PASS',b'50',b'0',b'0',b'0',b'0',b'50'
b'102',b'S',b'14',b'SB 14',b'Academic Standards/Rules Review/Coal Ash/Funds.      C RPT Adoption',b'3/26/2015 2:40 PM',b'Aye',b'PASS',b'110',b'3',b'0',b'7',b'0',b'113'
b'103',b'S',b'580',b'SR 580',"b""Honor State's Veterans.      Motion 8 To Adopt""",b'4/15/2015 2:47 PM',b'Aye',b'PASS',b'50',b'0',b'0',b'0',b'0',b'50'
b'106',b'S',b'7',b'SB 7',b'Allow Seating for Food Stand Customers.      Second Reading',b'4/16/2015 1:25 PM',b'Aye',b'PASS',b'44',b'0',b'0',b'6',b'0',b'44'
b'107',b'S',b'174',b'SB 174',b'Rail Corridor Lease/City of Wilmington.      Second Reading',b'4/16/2015 1:26 PM',b'Aye',b'PASS',b'44',b'0',b'0',b'6',b'0',b'44'
b'107',b'S',b'20',b'SB 20',"b""Internal Revenue Code Update/Motor Fuel Tax Changes.      R2 Ruled Mat'l   C RPT Adoption""",b'3/30/2015 7:35 PM',b'Aye',b'PASS',b'69',b'49',b'0',b'2',b'0',b'118'
b'108',b'S',b'238',b'SB 238',b'Stalking by GPS/Criminal Offense.      Amendment 1',b'4/16/2015 1:29 PM',b'Aye',b'PASS',b'44',b'0',b'0',b'6',b'0',b'44'
b'109',b'S',b'238',b'SB 238',b'Stalking by GPS/Criminal Offense.      Second Reading',b'4/16/2015 1:30 PM',b'Aye',b'PASS',b'44',b'0',b'0',b'6',b'0',b'44'
b'110',b'S',b'313',b'SB 313',b'License Plate/Retired Register of Deeds.      Second Reading',b'4/16/2015 1:32 PM',b'Aye',b'PASS',b'43',b'1',b'0',b'6',b'0',b'44'
b'111',b'S',b'712',b'SJR 712',b'Confirm Director of SBI.      Second Reading',b'4/16/2015 1:35 PM',b'Aye',b'PASS',b'44',b'0',b'0',b'6',b'0',b'44'
b'112',b'S',b'349',b'SB 349',b'Restore Driving Privileges/Competency.      Second Reading',b'4/20/2015 7:16 PM',b'Aye',b'PASS',b'49',b'0',b'0',b'1',b'0',b'49'
b'113',b'S',b'445',b'SB 445',"b""Burt's Law.      Amendment 1""",b'4/20/2015 7:20 PM',b'Aye',b'PASS',b'49',b'0',b'0',b'1',b'0',b'49'
b'114',b'S',b'445',b'SB 445',"b""Burt's Law.      Second Reading""",b'4/20/2015 7:21 PM',b'Aye',b'PASS',b'49',b'0',b'0',b'1',b'0',b'49'
b'114',b'S',b'20',b'SB 20',"b""Internal Revenue Code Update/Motor Fuel Tax Changes.      R3 Ruled Mat'l   C RPT Adoption""",b'3/31/2015 3:27 PM',b'Aye',b'PASS',b'79',b'39',b'0',b'2',b'0',b'118'
b'115',b'S',b'679',b'SB 679',b'NC Consumer Finance Act Amendments.      Amendment 1',b'4/20/2015 7:26 PM',b'Aye',b'PASS',b'48',b'0',b'1',b'1',b'0',b'48'
b'116',b'S',b'679',b'SB 679',b'NC Consumer Finance Act Amendments.      Amendment 2',b'4/20/2015 7:31 PM',b'Aye',b'PASS',b'46',b'2',b'1',b'1',b'0',b'48'
b'117',b'S',b'679',b'SB 679',b'NC Consumer Finance Act Amendments.      Amendment 3',b'4/20/2015 7:32 PM',b'Aye',b'PASS',b'48',b'0',b'1',b'1',b'0',b'48'
b'118',b'S',b'679',b'SB 679',b'NC Consumer Finance Act Amendments.      Second Reading',b'4/20/2015 7:33 PM',b'Aye',b'PASS',b'41',b'7',b'1',b'1',b'0',b'48'
b'119',b'S',b'661',b'SB 661',b'Private Labs Must Comply with CODIS.      Second Reading',b'4/21/2015 2:23 PM',b'Aye',b'PASS',b'50',b'0',b'0',b'0',b'0',b'50'
b'120',b'S',b'159',b'SB 159',b'Transferred Properties in Corrected Revals.      Amendment 1',b'4/22/2015 2:22 PM',b'Aye',b'PASS',b'48',b'0',b'0',b'2',b'0',b'48'
b'121',b'S',b'159',b'SB 159',b'Transferred Properties in Corrected Revals.      Second Reading',b'4/22/2015 2:24 PM',b'Aye',b'PASS',b'48',b'0',b'0',b'2',b'0',b'48'
b'122',b'S',b'284',b'SB 284',b'Infrastructure Assessments/Extend Sunset.      Second Reading',b'4/22/2015 2:25 PM',b'Aye',b'PASS',b'48',b'0',b'0',b'2',b'0',b'48'
b'123',b'S',b'22',b'SB 22',b'Historic Artifact Mgt. and Patriotism Act.      Amendment 1',b'4/22/2015 2:27 PM',b'Aye',b'PASS',b'48',b'0',b'0',b'2',b'0',b'48'
b'124',b'S',b'22',b'SB 22',b'Historic Artifact Mgt. and Patriotism Act.      Second Reading',b'4/22/2015 2:29 PM',b'Aye',b'PASS',b'48',b'0',b'0',b'2',b'0',b'48'
b'125',b'S',b'195',b'SB 195',b'Motor Vehicle Service Agreement Amendments.      Second Reading',b'4/22/2015 2:30 PM',b'Aye',b'PASS',b'48',b'0',b'0',b'2',b'0',b'48'
b'126',b'S',b'212',b'SB 212',b'Handgun Standards for Retired Sworn LEO.      Second Reading',b'4/22/2015 2:31 PM',b'Aye',b'PASS',b'48',b'0',b'0',b'2',b'0',b'48'
b'127',b'S',b'286',b'SB 286',b'Regulate the Sale of E-Liquid Containers.      Amendment 1',b'4/22/2015 2:33 PM',b'Aye',b'PASS',b'48',b'0',b'0',b'2',b'0',b'48'
b'128',b'S',b'286',b'SB 286',b'Regulate the Sale of E-Liquid Containers.      Second Reading',b'4/22/2015 2:35 PM',b'Aye',b'PASS',b'48',b'0',b'0',b'2',b'0',b'48'
b'129',b'S',b'298',b'SB 298',b'School Bus Cameras/Civil Penalties.      Amendment 2',b'4/22/2015 2:44 PM',b'Aye',b'PASS',b'42',b'6',b'0',b'2',b'0',b'48'
b'130',b'S',b'298',b'SB 298',b'School Bus Cameras/Civil Penalties.      Second Reading',b'4/22/2015 2:47 PM',b'Aye',b'PASS',b'46',b'2',b'0',b'2',b'0',b'48'
b'131',b'S',b'327',b'SB 327',b'Allow Prize-Linked Savings Accounts.      Second Reading',b'4/22/2015 2:50 PM',b'Aye',b'PASS',b'48',b'0',b'0',b'2',b'0',b'48'
b'132',b'S',b'371',b'SB 371',b'LME/MCO Claims Reporting.      Second Reading',b'4/22/2015 2:53 PM',b'Aye',b'PASS',b'48',b'0',b'0',b'2',b'0',b'48'
b'132',b'S',b'305',b'SB 305',b'NCEMPA Asset Sale.      Second Reading',b'3/31/2015 4:44 PM',b'Aye',b'PASS',b'115',b'0',b'2',b'3',b'0',b'115'
b'133',b'S',b'391',b'SB 391',b'Enjoin Street Gang/Expires in Three Years.      Second Reading',b'4/22/2015 2:55 PM',b'Aye',b'PASS',b'47',b'0',b'1',b'2',b'0',b'47'
b'134',b'S',b'435',b'SB 435',b'Business Court Amendment.      Second Reading',b'4/22/2015 2:57 PM',b'Aye',b'PASS',b'48',b'0',b'0',b'2',b'0',b'48'
b'135',b'S',b'482',b'SB 482',b'LLC Act Clarification.      Second Reading',b'4/22/2015 2:59 PM',b'Aye',b'PASS',b'48',b'0',b'0',b'2',b'0',b'48'
b'136',b'S',b'491',b'SB 491',b'Manufactured Home Purchase Agreement Change.      Second Reading',b'4/22/2015 3:00 PM',b'Aye',b'PASS',b'48',b'0',b'0',b'2',b'0',b'48'
b'136',b'S',b'305',b'SB 305',b'NCEMPA Asset Sale.      Third Reading',b'4/1/2015 2:35 PM',b'Aye',b'PASS',b'118',b'0',b'0',b'2',b'0',b'118'
b'137',b'S',b'570',b'SB 570',b'Expunction/Boat Violation.      Second Reading',b'4/22/2015 3:06 PM',b'Aye',b'PASS',b'46',b'2',b'0',b'2',b'0',b'48'
b'138',b'S',b'596',b'SB 596',b'Protection Against Unconst. Foreign Judgmnts.      Second Reading',b'4/22/2015 3:09 PM',b'Aye',b'PASS',b'48',b'0',b'0',b'2',b'0',b'48'
b'139',b'S',b'159',b'SB 159',b'Transferred Properties in Corrected Revals.      Third Reading',b'4/23/2015 12:12 PM',b'Aye',b'PASS',b'49',b'0',b'0',b'1',b'0',b'49'
b'140',b'S',b'284',b'SB 284',b'Infrastructure Assessments/Extend Sunset.      Third Reading',b'4/23/2015 12:13 PM',b'Aye',b'PASS',b'49',b'0',b'0',b'1',b'0',b'49'
b'141',b'S',b'303',b'SB 303',b'Protect Safety/Well-Being of NC Citizens.      Amendment 1',b'4/23/2015 12:16 PM',b'Aye',b'PASS',b'49',b'0',b'0',b'1',b'0',b'49'
b'142',b'S',b'303',b'SB 303',b'Protect Safety/Well-Being of NC Citizens.      Second Reading',b'4/23/2015 12:24 PM',b'Aye',b'PASS',b'40',b'9',b'0',b'1',b'0',b'49'
b'143',b'S',b'304',b'SB 304',b'Administration of Logo Sign Program.      Second Reading',b'4/23/2015 12:28 PM',b'Aye',b'PASS',b'49',b'0',b'0',b'1',b'0',b'49'
b'144',b'S',b'368',b'SB 368',b'DOD-Certified Child Care & State Subsidy.      Second Reading',b'4/23/2015 12:30 PM',b'Aye',b'PASS',b'49',b'0',b'0',b'1',b'0',b'49'
b'145',b'S',b'370',b'SB 370',b'E-Signatures/Vehicle Title and Registration.      Second Reading',b'4/23/2015 12:31 PM',b'Aye',b'PASS',b'49',b'0',b'0',b'1',b'0',b'49'
b'146',b'S',b'374',b'SB 374',b'Modify For-Hire License Logbook Requirement.      Second Reading',b'4/23/2015 12:33 PM',b'Aye',b'PASS',b'49',b'0',b'0',b'1',b'0',b'49'
b'147',b'S',b'534',b'SB 534',b'Study Student Online Data Privacy.      Second Reading',b'4/23/2015 12:34 PM',b'Aye',b'PASS',b'49',b'0',b'0',b'1',b'0',b'49'
b'148',b'S',b'536',b'SB 536',b'Students Know Before You Go.      Second Reading',b'4/23/2015 12:36 PM',b'Aye',b'PASS',b'49',b'0',b'0',b'1',b'0',b'49'
b'149',b'S',b'621',b'SB 621',b'Registration Renewal Notice/E-Mail.-AB      Second Reading',b'4/23/2015 12:37 PM',b'Aye',b'PASS',b'49',b'0',b'0',b'1',b'0',b'49'
b'150',b'S',b'670',b'SB 670',b'Term Limits for BOG Members.      Amendment 1',b'4/23/2015 12:49 PM',b'Aye',b'PASS',b'49',b'0',b'0',b'1',b'0',b'49'
b'151',b'S',b'670',b'SB 670',b'Term Limits for BOG Members.      Second Reading',b'4/23/2015 12:50 PM',b'Aye',b'PASS',b'49',b'0',b'0',b'1',b'0',b'49'
b'152',b'S',b'698',b'SB 698',b'State IT/Utility-Based Cloud Computing.      Second Reading',b'4/23/2015 12:51 PM',b'Aye',b'PASS',b'49',b'0',b'0',b'1',b'0',b'49'
b'153',b'S',b'298',b'SB 298',b'School Bus Cameras/Civil Penalties.      Third Reading',b'4/23/2015 12:54 PM',b'Aye',b'PASS',b'49',b'0',b'0',b'1',b'0',b'49'
b'154',b'S',b'25',b'SB 25',b'Zoning/Design and Aesthetic Controls.      Second Reading',b'4/27/2015 7:14 PM',b'Aye',b'PASS',b'43',b'7',b'0',b'0',b'0',b'50'
b'155',b'S',b'83',b'SB 83',b'Criminal Law/Filing False Document.      Second Reading',b'4/27/2015 7:17 PM',b'Aye',b'PASS',b'50',b'0',b'0',b'0',b'0',b'50'
b'155',b'S',b'78',b'SB 78',b'Off-Duty Correctional Officers/Conceal Carry.      Second Reading',b'4/1/2015 4:27 PM',b'Aye',b'PASS',b'107',b'9',b'2',b'2',b'0',b'116'
b'156',b'S',b'99',b'SB 99',"b'Fire, Rescue, & Safety Worker System Changes.      Amendment 1'",b'4/27/2015 7:18 PM',b'Aye',b'PASS',b'50',b'0',b'0',b'0',b'0',b'50'
b'157',b'S',b'99',b'SB 99',"b'Fire, Rescue, & Safety Worker System Changes.      Second Reading'",b'4/27/2015 7:18 PM',b'Aye',b'PASS',b'50',b'0',b'0',b'0',b'0',b'50'
b'158',b'S',b'288',b'SB 288',b'Amend Laws Regarding Mental Commitment Bars.      Second Reading',b'4/27/2015 7:20 PM',b'Aye',b'PASS',b'48',b'2',b'0',b'0',b'0',b'50'
b'159',b'S',b'301',b'SB 301',b'DOT/Purchase of Contaminated Land.-AB      Second Reading',b'4/27/2015 7:23 PM',b'Aye',b'PASS',b'48',b'2',b'0',b'0',b'0',b'50'
b'160',b'S',b'333',b'SB 333',b'Teacher Attrition Data.      Amendment 1',b'4/27/2015 7:25 PM',b'Aye',b'PASS',b'50',b'0',b'0',b'0',b'0',b'50'
b'161',b'S',b'333',b'SB 333',b'Teacher Attrition Data.      Second Reading',b'4/27/2015 7:26 PM',b'Aye',b'PASS',b'50',b'0',b'0',b'0',b'0',b'50'
b'162',b'S',b'336',b'SB 336',b'Estate Planning/Uniform Trust Code.      Amendment 1',b'4/27/2015 7:28 PM',b'Aye',b'PASS',b'50',b'0',b'0',b'0',b'0',b'50'
b'162',b'S',b'181',b'SB 181',b'Wake County Commissioner Districts.      A1 Gill   Second Reading',b'4/1/2015 5:45 PM',b'No',b'FAIL',b'43',b'62',b'7',b'8',b'0',b'105'
b'163',b'S',b'181',b'SB 181',"b'Wake County Commissioner Districts.      A2 Martin, G.   Second Reading'",b'4/1/2015 5:52 PM',b'No',b'FAIL',b'45',b'61',b'6',b'8',b'0',b'106'
b'163',b'S',b'336',b'SB 336',b'Estate Planning/Uniform Trust Code.      Second Reading',b'4/27/2015 7:32 PM',b'Aye',b'PASS',b'50',b'0',b'0',b'0',b'0',b'50'
b'164',b'S',b'382',b'SB 382',b'RFI/Privatization of Ferry System.      Second Reading',b'4/27/2015 7:34 PM',b'Aye',b'PASS',b'48',b'2',b'0',b'0',b'0',b'50'
b'164',b'S',b'181',b'SB 181',b'Wake County Commissioner Districts.      Second Reading',b'4/1/2015 5:59 PM',b'Aye',b'PASS',b'66',b'47',b'0',b'7',b'0',b'113'
b'165',b'S',b'419',b'SB 419',b'Limit Revolving Door Employment.      Second Reading',b'4/27/2015 7:36 PM',b'Aye',b'PASS',b'50',b'0',b'0',b'0',b'0',b'50'
b'166',b'S',b'455',b'SB 455',b'Iran Divestment Act.      Second Reading',b'4/27/2015 7:41 PM',b'Aye',b'PASS',b'49',b'1',b'0',b'0',b'0',b'50'
b'167',b'S',b'560',b'SB 560',b'GDAC Amendments.      Second Reading',b'4/27/2015 7:42 PM',b'Aye',b'PASS',b'50',b'0',b'0',b'0',b'0',b'50'
b'168',b'S',b'578',b'SB 578',b'Transition Certain Abuse Investigations/DCDEE.      Second Reading',b'4/27/2015 7:47 PM',b'Aye',b'PASS',b'50',b'0',b'0',b'0',b'0',b'50'
b'169',b'S',b'665',b'SB 665',b'Unclaimed Life Insurance Benefits.      Amendment 1',b'4/27/2015 7:50 PM',b'Aye',b'PASS',b'50',b'0',b'0',b'0',b'0',b'50'
b'170',b'S',b'665',b'SB 665',b'Unclaimed Life Insurance Benefits.      Second Reading',b'4/27/2015 7:52 PM',b'Aye',b'PASS',b'43',b'7',b'0',b'0',b'0',b'50'
b'171',b'S',b'667',b'SB 667',b'Principle-Based Reserving.      Second Reading',b'4/27/2015 7:54 PM',b'Aye',b'PASS',b'50',b'0',b'0',b'0',b'0',b'50'
b'172',b'S',b'668',b'SB 668',b'Auto Insurance/Allow Optional Enhancements.      Second Reading',b'4/27/2015 7:55 PM',b'Aye',b'PASS',b'50',b'0',b'0',b'0',b'0',b'50'
b'173',b'S',b'673',b'SB 673',b'Clarify Motor Vehicle Dealer Laws.      Second Reading',b'4/27/2015 7:59 PM',b'Aye',b'PASS',b'47',b'0',b'0',b'0',b'3',b'47'
b'174',b'S',b'674',b'SB 674',b'Truck Dealer Cost Reimbursement.      Second Reading',b'4/27/2015 8:01 PM',b'Aye',b'PASS',b'47',b'0',b'0',b'0',b'3',b'47'
b'175',b'S',b'423',b'SB 423',b'Foster Care Family Act.      Second Reading',b'4/28/2015 9:17 AM',b'Aye',b'PASS',b'48',b'0',b'0',b'2',b'0',b'48'
b'176',b'S',b'676',b'SB 676',b'Autism Health Insurance Coverage.      Second Reading',b'4/28/2015 9:25 AM',b'Aye',b'PASS',b'47',b'1',b'0',b'2',b'0',b'48'
b'177',b'S',b'336',b'SB 336',b'Estate Planning/Uniform Trust Code.      Third Reading',b'4/28/2015 9:26 AM',b'Aye',b'PASS',b'48',b'0',b'0',b'2',b'0',b'48'
b'178',b'S',b'182',b'SB 182',b'Automatic License Plate Readers.      Second Reading',b'4/28/2015 9:27 AM',b'Aye',b'PASS',b'47',b'1',b'0',b'2',b'0',b'48'
b'179',b'S',b'694',b'SB 694',b'Employee Misclassification Reform.      Amendment 1',b'4/29/2015 12:27 PM',b'Aye',b'PASS',b'50',b'0',b'0',b'0',b'0',b'50'
b'180',b'S',b'694',b'SB 694',b'Employee Misclassification Reform.      Amendment 2',b'4/29/2015 12:29 PM',b'Aye',b'PASS',b'50',b'0',b'0',b'0',b'0',b'50'
b'181',b'S',b'694',b'SB 694',b'Employee Misclassification Reform.      Second Reading',b'4/29/2015 12:32 PM',b'Aye',b'PASS',b'50',b'0',b'0',b'0',b'0',b'50'
b'182',b'S',b'566',b'SB 566',b'Disposition of Minimal Property Tax Refunds.      Second Reading',b'4/29/2015 12:37 PM',b'Aye',b'PASS',b'50',b'0',b'0',b'0',b'0',b'50'
b'183',b'S',b'88',b'SB 88',b'Pole Attachment Disputes.      Second Reading',b'4/29/2015 12:39 PM',b'Aye',b'PASS',b'45',b'5',b'0',b'0',b'0',b'50'
b'184',b'S',b'95',b'SB 95',b'Performance-Based RIF/School Policy.      Second Reading',b'4/29/2015 12:40 PM',b'Aye',b'PASS',b'50',b'0',b'0',b'0',b'0',b'50'
b'185',b'S',b'97',b'SB 97',b'State Advisory Council on Indian Education.      Second Reading',b'4/29/2015 12:41 PM',b'Aye',b'PASS',b'50',b'0',b'0',b'0',b'0',b'50'
b'186',b'S',b'119',b'SB 119',b'GSC Technical Corrections 2015.      Second Reading',b'4/29/2015 12:43 PM',b'Aye',b'PASS',b'50',b'0',b'0',b'0',b'0',b'50'
b'187',b'S',b'120',b'SB 120',b'DOI License Processing Fees.      Second Reading',b'4/29/2015 12:44 PM',b'Aye',b'PASS',b'50',b'0',b'0',b'0',b'0',b'50'
b'188',b'S',b'124',b'SB 124',b'Modernize Assumed Business Name Statutes.      Amendment 1',b'4/29/2015 12:46 PM',b'Aye',b'PASS',b'50',b'0',b'0',b'0',b'0',b'50'
b'189',b'S',b'124',b'SB 124',b'Modernize Assumed Business Name Statutes.      Second Reading',b'4/29/2015 12:46 PM',b'Aye',b'PASS',b'50',b'0',b'0',b'0',b'0',b'50'
b'190',b'S',b'192',b'SB 192',b'Citations/Sheriffs Accept Faxes.      Second Reading',b'4/29/2015 1:12 PM',b'Aye',b'PASS',b'50',b'0',b'0',b'0',b'0',b'50'
b'191',b'S',b'211',b'SB 211',b'Damages for Late Payment of Monies/Charters.      Second Reading',b'4/29/2015 1:13 PM',b'Aye',b'PASS',b'50',b'0',b'0',b'0',b'0',b'50'
b'192',b'S',b'273',b'SB 273',b'Motor Vehicle Tax: Waive Penalties/Interest.      Second Reading',b'4/29/2015 1:14 PM',b'Aye',b'PASS',b'50',b'0',b'0',b'0',b'0',b'50'
b'193',b'S',b'299',b'SB 299',b'Port Usage Contracts/Public Records.      Second Reading',b'4/29/2015 1:16 PM',b'Aye',b'PASS',b'50',b'0',b'0',b'0',b'0',b'50'
b'194',b'S',b'330',b'SB 330',b'Change Orders on School Construction Projects.      Amendment 1',b'4/29/2015 1:17 PM',b'Aye',b'PASS',b'50',b'0',b'0',b'0',b'0',b'50'
